,Timestamp,email,firstname,lastname,matrikel,birth,address,mobil,gender,startP,branch,Institute,SuperWork,ThesisSub,TitleOfPoster,Autor,Affiliation,Abstract,alrPart,equipment,motivation,duty,notes
42,2018/10/20 2:29:59 PM GMT+1,Mueller@email.de,Heinz,Mueller,999999,1988-09-01,Blumenstrasse 1,+49 176 111 111 11,Male,2018-09-01,Astronomy and Cosmic Physics,MPIA,Einstein,curabitur conubia egestas,curabitur conubia egestas,"Heinz Mueller, Hans Wurst",1Max Planck Institute for Astronomy,"Lorem ipsum felis non nibh ipsum at lorem morbi, aenean iaculis porttitor rhoncus cubilia aliquam quis hac, bibendum semper pretium suscipit purus hac per.

Vivamus aptent tristique mattis vel amet fames habitant lobortis dui convallis sociosqu iaculis volutpat, tempor est varius felis imperdiet dapibus potenti eget arcu accumsan neque interdum at congue praesent conubia amet.

Tincidunt facilisis tristique cras nisl ligula malesuada aliquet sodales ullamcorper egestas orci felis purus, imperdiet rutrum a sed porta lacus per eget blandit mi sed congue.

Maecenas himenaeos cursus placerat pharetra primis ornare euismod vivamus tellus malesuada magna odio aliquam imperdiet phasellus nisi aliquam iaculis facilisis nisl sagittis ultricies aenean.

",Yes,"Yes, Ski",Organizer,Yes,
1,2018/10/21 2:29:59 PM GMT+1,Husten@email.de,Helmut,Husten,888999,1991-09-21,Blumenstrasse 9,+49 176 111 999 11,Female,2016-06-01,Astronomy and Cosmic Physics,MPIK,Planck,curabitur conubia egestas,curabitur conubia egestas,"Heinz Mueller, Helmut Husten",1MPIK,bla blubb,Yes,"Yes, Ski",NaN,Yes,
